	{
		"id": "disease:asthma",
		"type": "disease", 
		"pathology": "Severe Persistent Asthma",
		"symptom": "Cough, wheeze, chest tightness or difficulty breathing continuously", 
		"PhysicalActivity": "Severely limit daily physical activities.",
		"possibleComplication": "Nighttime symptoms frequently",
		"dateCreated": "2017-01-02T09:25:55.00Z",
		"dateModified": "2017-02-02T011:13:55.00Z"
	}